{
  "generation_id": "GEN_PA_EP01_S02_SH001_CUT3_HIGGSFIELD_V01",
  "shot_id": "EP01_S02_SH001",
  "stage": "STILL",
  "provider": "Higgsfield",
  "model": "NANO_BANANA_2 (catalog id nano_banana_2 -> job_set_type nano_banana_flash, 2k 16:9, 1 image reference; D-036)",
  "provider_job": {
    "job_id": "d5c835b5-6012-472e-be26-b8e350fbf9d8",
    "job_set_type": "nano_banana_flash",
    "display_name": "Nano Banana 2",
    "params_path": "08_GENERATION_CACHE/EP01/provider_jobs/HF_d5c835b5-6012-472e-be26-b8e350fbf9d8.json"
  },
  "prompt_id": "PRM_PA_EP01_S02_SH001_CUT3_V01",
  "prompt_version": "V01",
  "standard_versions": {
    "PHOTO_AI_STANDARD.md": "v0.1 ACTIVE (D-035)",
    "COST_STANDARD.md": "v0.1",
    "RIGHTS_STANDARD.md": "v0.1"
  },
  "case_ids_used": [],
  "approval_id": "APR_EP01_PA_002",
  "input_paths": [
    "02_SEASONS/S01/EP01/02_SOURCES/RTS_COMMONS_HWANGNAMDAECHONG_GAGNON_001.jpg"
  ],
  "output_paths": [
    "08_GENERATION_CACHE/EP01/AI_STILL/PA_S02_SH001_CUT3_V01_d5c835b5.png"
  ],
  "attempts": 1,
  "duration_sec": null,
  "cost": {
    "currency": "CREDITS",
    "amount": 2.0,
    "spent": 2.0,
    "note": "Batch generate_image_batch (8 jobs). Balance before 1674.58 -> after 1658.58."
  },
  "result_status": "SUCCESS",
  "failure_id": null,
  "started_at": "2026-09-14T10:30:00Z",
  "finished_at": null,
  "run_by": "Claude Code (Pipeline A batch 1, D-039)",
  "notes": "Sent text == prompt.assembled_text (verified at submission). Bot check pending owner OK/FIX (8 at once, D-039)."
}
