{
  "generation_id": "GEN_MP_LABORER_V02_SAMPLE_HIGGSFIELD_V01",
  "shot_id": "MASTER_PACK:CHAR_SILLA_LABORER_GROUP_01:costume_v02_sample",
  "stage": "STILL",
  "provider": "Higgsfield",
  "model": "NANO_BANANA_PRO (CLI; costume V02 DRAFT review sample)",
  "provider_job": {
    "job_id": "52271b98-0beb-4320-9ca8-cd0bba9efd4a",
    "job_set_type": "nano_banana_pro",
    "display_name": "Nano Banana Pro",
    "params_path": "08_GENERATION_CACHE/EP01/provider_jobs/HF_52271b98-0beb-4320-9ca8-cd0bba9efd4a.json"
  },
  "prompt_id": "PRM_MP_CHAR_SILLA_LABORER_GROUP_01_COSTUME_V02_SAMPLE_V01",
  "prompt_version": "V01",
  "standard_versions": {
    "VISUAL_STYLE_BIBLE.md": "v0.2",
    "COST_STANDARD.md": "v0.1"
  },
  "case_ids_used": [],
  "approval_id": "APR_EP01_COSTUME_V02_SAMPLE_001",
  "input_paths": [],
  "output_paths": [
    "08_GENERATION_CACHE/EP01/MP_CROWD/COSTUME_V02_SAMPLES/LABORER_V02_SAMPLE_52271b98.png"
  ],
  "attempts": 1,
  "duration_sec": null,
  "cost": {
    "currency": "CREDITS",
    "amount": 2.0,
    "spent": 2.0,
    "note": "sample"
  },
  "result_status": "SUCCESS",
  "failure_id": null,
  "started_at": "2026-09-17T13:05:00Z",
  "finished_at": null,
  "run_by": "Claude Code (costume V02 samples for owner)",
  "notes": "Review sample, not a master pack slot. Owner decision pending."
}
