{
  "generation_id": "GEN_MP_CHAR_SILLA_LABORER_GROUP_01_RECAST_FULL_BODY_V04",
  "shot_id": "MASTER_PACK: CHAR_SILLA_LABORER_GROUP_01",
  "stage": "STILL",
  "provider": "Higgsfield",
  "model": "NANO_BANANA_PRO (nano_banana_pro 3:4 2k via CLI)",
  "provider_job": {
    "job_id": "8d0649ac",
    "job_set_type": "nano_banana_pro",
    "display_name": "Nano Banana Pro",
    "params_path": "08_GENERATION_CACHE/EP01/provider_jobs/HF_8d0649ac.json"
  },
  "prompt_id": "PRM_MP_CHAR_SILLA_LABORER_GROUP_01_RECAST_FULL_BODY_V04",
  "prompt_version": "V04",
  "standard_versions": {
    "VISUAL_STYLE_BIBLE.md": "v0.2",
    "COST_STANDARD.md": "v0.1"
  },
  "case_ids_used": [],
  "approval_id": "APR_EP01_MP_RECAST_V04_001",
  "input_paths": [],
  "output_paths": [
    "08_GENERATION_CACHE/EP01/MP_RECAST_V04/LABORER_FULL_BODY_V04_8d0649ac.png"
  ],
  "attempts": 1,
  "duration_sec": null,
  "cost": {
    "currency": "CREDITS",
    "amount": 2.0,
    "spent": 2.0,
    "note": "D-056 recast V04"
  },
  "result_status": "SUCCESS",
  "failure_id": null,
  "started_at": "2026-09-19T09:30:00Z",
  "finished_at": "2026-09-19T09:35:00Z",
  "run_by": "Claude Code (D-056 recast V04)",
  "notes": "Bot QC FAIL (format): 5 of 6 returned multi-person workshop scenes instead of a single figure on a plain backdrop; attendant waist cord tied in a forbidden bow; labourer and attendant read as the same rank. Costume rules themselves were kept (long sleeves, shallow straight collar, NO chest tie - the 09-17 defect is gone). Only ATTENDANT_FULL_BODY usable."
}