{
  "generation_id": "GEN_MP_ELITE_FULL_BODY_HIGGSFIELD_V01",
  "shot_id": "MASTER_PACK:CHAR_SILLA_ELITE_OBSERVER_01:full_body",
  "stage": "STILL",
  "provider": "Higgsfield",
  "model": "nano_banana_pro (2k, 2:3, image_references=hero V02)",
  "prompt_id": "PRM_MP_CHAR_SILLA_ELITE_OBSERVER_01_FULL_BODY_V01",
  "prompt_version": "V01",
  "standard_versions": {
    "CHARACTER_CONTINUITY_STANDARD.md": "v0.1",
    "COST_STANDARD.md": "v0.1"
  },
  "case_ids_used": [
    "CASE_DDABONG_CHAR_001"
  ],
  "approval_id": "APR_EP01_MP_ELITE_BATCH1_001",
  "input_paths": [
    "08_GENERATION_CACHE/EP01/MP_ELITE/MP_ELITE_HERO_V02_c7a5cc92.png"
  ],
  "output_paths": [
    "08_GENERATION_CACHE/EP01/MP_ELITE/MP_ELITE_FULL_BODY_V01_5681f1e0.png"
  ],
  "attempts": 1,
  "duration_sec": null,
  "cost": {
    "currency": "CREDITS",
    "amount": 2.0,
    "spent": 2.0,
    "note": "Higgsfield job 5681f1e0-fe07-4fc3-b36c-f512dc7a2992"
  },
  "result_status": "SUCCESS",
  "failure_id": null,
  "started_at": "2026-09-11T13:39:09Z",
  "finished_at": "2026-09-11T13:39:50Z",
  "run_by": "Image Generation Agent (Claude Code)",
  "notes": "Head to toe, plain earth ground. Below-knee muted blue outer robe, ivory inner narrow sleeves, wide grey trousers, bronze belt with pendants, ankle boots over socks. Natural proportions -> use for height_ratio. Same face. No forbidden elements, no text."
}
