{
  "generation_id": "GEN_EP01_S06_SH010_BL_HIGGSFIELD_V01",
  "shot_id": "EP01_S06_SH010",
  "stage": "STILL",
  "provider": "Higgsfield",
  "model": "NANO_BANANA_PRO (nano_banana_pro 16:9 2k via CLI; image_references = Blender clay render [+ elder hero V07 / back view])",
  "provider_job": {
    "job_id": "6a9f803f-0b09-40c8-a645-4aa56afe933d",
    "job_set_type": "nano_banana_pro",
    "display_name": "Nano Banana Pro",
    "params_path": "08_GENERATION_CACHE/EP01/provider_jobs/HF_6a9f803f-0b09-40c8-a645-4aa56afe933d.json"
  },
  "prompt_id": "PRM_EP01_S06_SH010_BL_V01",
  "prompt_version": "V01",
  "standard_versions": {
    "VISUAL_STYLE_BIBLE.md": "v0.2",
    "COST_STANDARD.md": "v0.1"
  },
  "case_ids_used": [],
  "approval_id": "APR_EP01_BL_A_001",
  "input_paths": [
    "08_GENERATION_CACHE/EP01/BLENDER/CAM_S06_SH010_H06_clay.png"
  ],
  "output_paths": [
    "08_GENERATION_CACHE/EP01/BLENDER_PHOTOREAL/H06_BL_V01_6a9f803f.png"
  ],
  "attempts": 1,
  "duration_sec": null,
  "cost": {
    "currency": "CREDITS",
    "amount": 2.0,
    "spent": 2.0,
    "note": "batch A 4 shots = 8 credits (1457.03 -> 1449.03)"
  },
  "result_status": "SUCCESS",
  "failure_id": null,
  "started_at": "2026-09-17T07:25:00Z",
  "finished_at": null,
  "run_by": "Claude Code (D-055 Phase 3 batch A via CLI)",
  "notes": "Bot QC: see REVIEW_BATCH_A. Owner OK/FIX pending."
}
