{
  "generation_id": "GEN_EP01_INSERT_G04_OMNI_V03",
  "shot_id": "EP01_S06_SH010",
  "stage": "VIDEO",
  "provider": "Higgsfield",
  "model": "GEMINI_OMNI_FLASH_1_1 (gemini_omni_flash_1_1 image-to-video 8s 720p 16:9 via CLI; start_image = Blender tech pass)",
  "provider_job": {
    "job_id": "808c212b-3a90-426c-9f66-010dfc0f00c0",
    "job_set_type": "gemini_omni_flash_1_1",
    "display_name": "Gemini Omni Flash 1.1",
    "params_path": "08_GENERATION_CACHE/EP01/provider_jobs/HF_808c212b-3a90-426c-9f66-010dfc0f00c0.json"
  },
  "prompt_id": "PRM_EP01_INSERT_G04_V03",
  "prompt_version": "V03",
  "standard_versions": {
    "VISUAL_STYLE_BIBLE.md": "v0.2",
    "COST_STANDARD.md": "v0.1"
  },
  "case_ids_used": [],
  "approval_id": "APR_EP01_INSERT_001",
  "input_paths": [
    "08_GENERATION_CACHE/EP01/HERITAGE_INSERT/CAM_G04_SECTION_tech.png"
  ],
  "output_paths": [
    "08_GENERATION_CACHE/EP01/HERITAGE_INSERT/INSERT_G04_SECTION_OMNI_V03_808c212b.mp4"
  ],
  "attempts": 1,
  "duration_sec": 8.0,
  "cost": {
    "currency": "CREDITS",
    "amount": 24.0,
    "spent": 24.0,
    "note": "V03 no-numbers instruction test"
  },
  "result_status": "SUCCESS",
  "failure_id": null,
  "started_at": "2026-09-19T05:27:34Z",
  "finished_at": "2026-09-19T05:30:00Z",
  "run_by": "Claude Code (V03)",
  "notes": "Bot QC FAIL: dimension labels still rendered 0-3.3 s (47 m / 12.7 m / 1.7 m / 6.6 m plus a wrong 6.7 m), fading only after 4 s; model invented two side chambers/doorways flanking the stone dome (not a feature of stone-mound wooden-chamber tombs). Proportions and orbit fine. V02 remains the best take. See REVIEW_INSERT_G04_OMNI_V03_20260919.md"
}